{
  "schema_version": "2.0",
  "request_id": "req-onboard-002",
  "tenant_id": "tenant-acme",
  "intent": "Classificar solicitações recebidas por importação.",
  "priority": "normal",
  "budget": "900.50",
  "deadline_at": "2026-09-02T12:00:00+00:00",
  "idempotency_key": "idem-onboard-002",
  "source": "import"
}

